{
  "$schema": "https://json-schema.org/draft/2020-12/schema",
  "$id": "crypto_perp_ticker_manifest.v1.schema.json",
  "type": "object",
  "additionalProperties": false,
  "required": [
    "schema_version",
    "manifest_id",
    "created_at",
    "artifact",
    "version",
    "exchange",
    "market_type",
    "symbols",
    "capture_mode",
    "coverage_class",
    "supports_cost_adjusted_estimate",
    "supports_edge_action",
    "window",
    "row_count_total",
    "row_count_after_dedupe",
    "fields_present",
    "warnings",
    "raw_inputs",
    "network_attempted",
    "credentials_used",
    "exchange_write_used",
    "live_order_submitted"
  ],
  "properties": {
    "schema_version": {"const": "crypto_perp_ticker_manifest.v1"},
    "manifest_id": {"type": "string", "minLength": 1},
    "created_at": {"$ref": "#/$defs/utc_second"},
    "artifact": {"const": "ticker_rows"},
    "version": {"const": 1},
    "exchange": {"type": "string", "minLength": 1},
    "market_type": {"type": "string", "minLength": 1},
    "symbols": {"type": "array", "items": {"type": "string", "minLength": 1}},
    "capture_mode": {"type": "string", "minLength": 1},
    "coverage_class": {
      "enum": ["native", "reconstructed_bbo", "reconstructed_last_mark", "cross_venue", "absent"]
    },
    "supports_cost_adjusted_estimate": {"type": "boolean"},
    "supports_edge_action": {"type": "boolean"},
    "window": {
      "type": "object",
      "additionalProperties": false,
      "required": ["start_ms", "end_ms"],
      "properties": {
        "start_ms": {"type": ["integer", "null"], "minimum": 0},
        "end_ms": {"type": ["integer", "null"], "minimum": 0}
      }
    },
    "row_count_total": {"type": "integer", "minimum": 0},
    "row_count_after_dedupe": {"type": "integer", "minimum": 0},
    "fields_present": {"type": "array", "items": {"type": "string", "minLength": 1}},
    "warnings": {"type": "array", "items": {"type": "string", "minLength": 1}},
    "raw_inputs": {"type": "array", "items": {"type": "string", "minLength": 1}},
    "network_attempted": {"type": "boolean"},
    "credentials_used": {"const": false},
    "exchange_write_used": {"const": false},
    "live_order_submitted": {"const": false}
  },
  "$defs": {
    "utc_second": {
      "type": "string",
      "pattern": "^\\d{4}-\\d{2}-\\d{2}T\\d{2}:\\d{2}:\\d{2}Z$"
    }
  }
}
