{
  "schema_version": "crypto_perp_ticker_manifest.v1",
  "manifest_id": "seed-foundry-a1-ticker-fixture",
  "created_at": "2026-07-16T00:00:00Z",
  "artifact": "ticker_rows",
  "version": 1,
  "exchange": "bitget",
  "market_type": "perp_linear",
  "symbols": ["BTCUSDT", "ETHUSDT"],
  "capture_mode": "rest_ticker",
  "coverage_class": "native",
  "supports_cost_adjusted_estimate": true,
  "supports_edge_action": true,
  "window": {
    "start_ms": 1784160000000,
    "end_ms": 1784160000000
  },
  "row_count_total": 2,
  "row_count_after_dedupe": 2,
  "fields_present": [
    "last_px",
    "bid_px",
    "ask_px",
    "mark_px",
    "index_px",
    "funding_rate",
    "open_interest"
  ],
  "warnings": [
    "CURRENT_TICKER_SNAPSHOT_ONLY",
    "HISTORICAL_BID_ASK_TICKER_NOT_AVAILABLE_FROM_BITGET_PUBLIC_REST"
  ],
  "raw_inputs": ["bitget.mix.market.tickers"],
  "network_attempted": false,
  "credentials_used": false,
  "exchange_write_used": false,
  "live_order_submitted": false
}
